"shop_no","rgn2_nm","content"
"575237","강남구","디저트,커피, 디저트·커피, 달콤, 음료판매, 해쨍쨍, 집에서데이트, 비쥬얼, 밀푀유, 일본느낌, 여자들끼리, 브런치, 당근케이크, 간식, 혼디, 동아리방, 시로이쇼트, 가벼운식사, 연인끼리, 입소문난, 시카고초코, 촉촉, 빵덕후, 봄, 아이와어른함께, 고퀄리티, 캠퍼스안, 까페, 세젤맛, 빵집, 과방"
"613248","강서구","한식, 비오는날, 밥집, 매콤, 점심, 저녁, 집에서데이트, 내방, 가족식탁용, 진한국물, 중독성쩔어, 스페셜부대찌개, 부담없는, 얼큰, 매운음식덕후, 8090, 따끈한, 사리넣으면맛있는, 돈돌부대찌개, 푸짐한, 숨겨진맛집, 집밥, 숙취해소, 버섯부대찌개, 갓집밥"
"616996","양천구","한식, 사무실, 비오는날, 밥집, 국밥성애자, 점심, 들깨굴떡국, 저녁, 내방, 가족식탁용, 굴국밥, 굴양념밥, 제육덮밥, 진한국물, 가정식, 부담없는, 들깨굴국밥, 굴떡국, 힐링푸드, 정갈한, 남자들끼리, 따끈한, 퇴근후, 건강해지는느낌, 과방, 보양식, 밥말아먹기좋은, 담백"
"632641","서초구","디저트·커피, 패밀리, 주말, 달콤, 음료판매, 친구들이랑, 부드러운, 집에서데이트, 해쨍쨍, 프랜차이즈, 입에서순삭, 하프갤론, 아이스크림, 간식, 혼디, 동아리방, 카페, 상큼, 아이스크림케익, 시원한, 폭염, 쿼터, 부담없는, 세젤맛, 버라이어티팩, 쫀득, 야구장, 파인트, 취향저격"
"641984","관악구","고기, 한식, 음료판매, 한우국밥, 회식, 저녁, 부드러운, 나들이, 육즙이흐르는, 안주로딱좋은, 정통한식, 갈비탕, 폭식하는날, 푸짐한, 설렁탕, 사무실, 레알인정, 도가니탕, 비오는날, 고기성애자, 헤비한메뉴, 사시사철, 점심, 소뼈해장국, 가족식탁용, 가성비갑, 부담없는, 소고기국밥, 24시간영업, 불맛"
"642919","강남구","아시안, 한강공원, 밥집, 파인애플볶음밥, 점심, 저녁, 내방, 나시고랭, 가족식탁용, 맑은국물, 외국친구들이랑, 진한국물, 또먹고싶다, 부담없는, 특이한메뉴, 힐링푸드, 여자들끼리, 정갈한, 찬바람쌩쌩, 재료가신선한, 저칼로리, 점심에붐비는, 짭짤한, 이색맛집, 맛점, 사무실, 연인끼리"
"682027","영등포구","분식, 한끼식사되는, 쌀덕후, 패스트푸드, 쏘야밥버거, 부드러운, 집에서데이트, 프랜차이즈, 특이한메뉴, 착한가격, 햄치즈밥버거, 혼밥, 아점, 간식, 동아리방, 봉구스밥버거, 가벼운식사, 치즈떡갈비밥버거, 제육밥버거, 치즈제육밥버거, 밥집, 건강빵, 사시사철, 점심, 짱맛, 가성비갑, 캠퍼스안, 힐링푸드, 통살돈까스밥버거, 꿀조합, 간편하게먹기, 과방, 런치세트"
"683516","강동구","일식·회, 아시안, 수제함바그카레라이스, 바삭바삭, 덮밥덕후, 친구들이랑, 돈까스, 규동, 입소문난, 점심, 저녁, 이국적, 촉촉, 사시사철, 세트메뉴가있는, 프랜차이즈, 내방, 웨이팅긴곳, 속이든든한, 중독성쩔어, 가라아게마요동, 풍미가깊은, 따끈한, 카레, 송파주민인정, 기름진, 사무실, 연인끼리"
"688297","광진구","분식, 한끼식사되는, 마늘떡볶이, 친구들이랑, 매콤, 쌀덕후, 저녁, 부드러운, 내방, 떡볶이, 입에서순삭, 분식, 여자들끼리, 착한가격, 혼밥, 간식, 푸짐한, 밀가루덕후, 매콤제육김밥, 사무실, 맛점, 빨리먹을수있는, 회사동료랑, 와사비참치김밥, 점심, 김밥, 넛트멸치김밥, 부담없는, 꿀조합, 간편하게먹기, 더블치즈김밥, 단골폭발, 퇴근후, 쫄깃쫄깃, 야식, 맛있으면0칼로리, 찰순대, 담백"
"700945","강남구","고기, 한강공원, 저녁, 프랜차이즈, 육즙이흐르는, 안주로딱좋은, 소곱창, TV맛집, 소대창, 안주가맛있는, 착한가격, 사무실, 쌀쌀할때, 겨울, 곱창모듬, 헤비한메뉴, 주당, 스트레스풀자, 재료가신선한, 따끈한, 밥볶아먹기좋은, 퇴근후, 야식, 맛있으면0칼로리, 소막창, 고소한, 연중무휴, 포차, 담백"
"704011","강동구","디저트·커피, NEW, 샌드위치, 아메리카노"
"713980","성남시 분당구","분식, 한식, 칼국수, 면덕후, 만두"
"715594","성남시 분당구","디저트·커피, 아이스크림, 와플, 디저트홀릭"
"724416","고양시 일산동구","null"
"725110","강남구","아시안, 회사동료랑, 비오는날, 여름, 찹쌀탕수육, 헤비한메뉴, 속이풀리는, 점심, 깔끔, 짬뽕, 얼큰, 매운음식덕후, 국물덕후, 점심에붐비는, 입맛없을때, 튀김덕후, 불맛, 숨겨진맛집"
"726203","중구","디저트·커피, 와플, 아메리카노"
"729868","부평구","아시안, 썸남썸녀랑, 매콤, 입소문난, 저녁, 램티카, 이국적, 넌베지탈리세트, 커리, 비쥬얼, 밥한공기뚝딱, 홈메이드, 풍미가깊은, 히말리난, 착한가격, 혼밥, 인도음식, 버터치킨마카니, 탄두리치킨, 토핑이다양한, 카페전문, 맛점, 연인끼리"
"732770","성동구","한식, 고향의맛, 아삭아삭, 한끼식사되는, 밥집, 쌀덕후, 회식, 직원이자신있어하는, 점심, 깔끔, 꽃게장비빔밥, 원조, 동창모임, 정통한식, 비빔밥, 재료가신선한, 충무김밥, 갈비, 막회비빔밥, 짭짤한, 소갈비찜, 집밥, 닭볶음탕, 전주비빔밥"
"733905","관악구","분식, 분식덕후, 바삭바삭, 덮밥덕후, 친구들이랑, 매콤, 돈까스, 북어해장국, 저녁, 등심돈까스, 김밥, 가성비갑, 소고기미역국, 캠퍼스안, 분식, 소고기무국, 뼈없는불닭발, 쫄깃쫄깃, 짭짤한, 입맛없을때, 혼밥, 집밥, 닭볶음탕, 맛점"
"737451","구로구","아시안, NEW, 쌀국수, 볶음밥"
"740635","용산구","양식, 보더샘플러, 썸남썸녀랑, 바삭바삭, 매콤, 낮술, 이국적, 철판요리, 한잔하고싶을때, 안주로딱좋은, 특이한메뉴, 입에서순삭, 화이타샐러드, 퀘사디아, 짭짤한, 멕시코전문점, 화이타, 부리또, 이색맛집, 맛점, 연인끼리"
"741373","강서구","디저트·커피, 한강공원, 달콤, 음료판매, 친구들이랑, 점심, 조각케익, 저녁, 깔끔, 시원한, 베이커리, 부드러운, 디저트홀릭, 나들이, 향이좋은, 티라미수, 얼그레이무스, 카페, 연인끼리"
"745967","성동구","디저트·커피, 주말, 여름, 달콤, 음료판매, 시원한, 디저트홀릭, 촉촉, 해쨍쨍, 부드러운, 집에서데이트, 폭염, 향이좋은, 라떼, 마끼아또, 브레드, 스무디, 여자들끼리, 그린티프라페, 브런치, 아메리카노, 카페, 요거트스무디"
"751818","서초구","일식·회, NEW, 연어사시미, 회사동료랑, 친구들이랑, 매콤, 야끼소바, 나베, 깔끔, 소스가맛있는, 이자카야, 철판요리, 주당, 한잔하고싶을때, 편맥과함께, 안주로딱좋은, 일본느낌, 문어초회, 꿀조합, 나가사키짬뽕, 문어숙회, 짭짤한, 우삼겹숙주볶음, 야식, 맛집사냥꾼"
"755740","강남구","디저트·커피, NEW, 연인끼리, 여름, 달콤, 바삭바삭, 음료판매, 딸기라떼, 시원한, 디저트홀릭, 베이커리, 향이좋은, 라떼, 여자들끼리, 달콤한, 스콘, 브런치, 착한가격, 한라봉에이드, 입맛없을때, 간식, 아메리카노, 죠리퐁라떼, 카페, 브라우니"
"759873","부평구","디저트·커피, NEW, 컵케익"
"765614","성북구","디저트·커피, 도넛, 빵, 케익"
"769756","강남구","고기, 한식, NEW, 회사동료랑, 백숙, 밥집, 깔끔, 초복중복말복, 스트레스풀자, 폭염, 맑은국물, 속이든든한, 삼계탕, 한상차림, 따끈한, 숯불닭구이, 칼칼한, 맛있게매운, 닭도리탕, 푸짐한, 보양식, 담백"
"777678","서초구","일식·회, NEW, 한끼식사되는, 덮밥덕후, 바삭바삭, 친구들이랑, 밥집, 돈까스, 입소문난, 점심, 소스가맛있는, 치킨가라아게김치동, 내방, 판모밀, 치즈돈까스, 간편하게먹기, 오므라이스, 짭짤한, 입맛없을때, 착한가격, 혼밥, 푸짐한"
"780147","부천시","디저트·커피, NEW, 와플, 아메리카노"
"793144","마포구","null"
"794150","서초구","한식, NEW, 제육볶음, 순두부찌개"
"795696","고양시 일산동구","일식·회, NEW, 대하소금구이, 간장새우"
"798148","강북구","null"
"798809","강남구","null"
"799102","용산구","null"
"800324","중구","null"
"599694","관악구","고기, 한식대첩, 한식, 고기사랑, 육식인간, 주말, 육회, 친구들이랑, 고기성애자, 입소문난, 선선할때, 저녁, 퓨전한식, 육사시미, 부드러운, 나들이, 육회탕탕이, 형제집모듬스페셜, 고퀄리티, 캠퍼스안, 육즙이흐르는, 입에서순삭, 안주로딱좋은, 재료가신선한, 남자들끼리, 육회와생연어, 퇴근후, 육회비빔밥, 푸짐한, 보양식, 사무실"
"621173","동작구","아시안, 담백, 친구들이랑, 쌀덕후, 진한국물, 속이든든한, 여자들끼리, 태국식소고기팟타이, 면덕후, 혼밥, 푸짐한, 이색맛집, 점저, 졸맛, 맛점, 쌀쌀할때, 밥집, 탄성자동발사, 점심, 짱맛, 세트메뉴가있는, 양지차돌박이쌀국수, 중독성쩔어, 부담없는, 꿀조합, 따끈한, 점심에붐비는, 숙취해소, 연중무휴, 취향저격"
"627679","서초구","일식·회, 주말, 쌀쌀할때, 비오는날, 매콤, 입소문난, 직원이자신있어하는, 점심, 부드러운, 버섯코코넛크림카레라이스, 내방, 비쥬얼, 속이든든한, 고퀄리티, 일본느낌, 카레우동, 가을, 입에서순삭, 풍미가깊은, 따끈한, 카레, 자극적인, 혼밥, 고소한, 졸맛"
"627865","동작구","고기, 한식, 제육볶음, 한끼식사되는, 저녁에붐비는, 밥집, 매콤, 입소문난, 점심, 저녁, 양푼생고기김치찌개, 속이든든한, 입에서순삭, 재료가신선한, 따끈한, 점심에붐비는, 사리넣으면맛있는, 단골폭발, 착한가격, 사르르녹는, 왕계란말이, 돼지고기김치찌개, 푸짐한, 집밥, 빨리먹을수있는, 졸맛"
"644348","송파구","한식, 빨리먹을수있는, 담백, 한끼식사되는, 치즈제육밥버거, 밥집, 음료판매, 점심, 깔끔, 퓨전한식, 쏘야밥버거, 가정식, 가성비갑, 캠퍼스안, 부담없는, 통살돈까스밥버거, 간편하게먹기, 착한가격, 햄치즈밥버거, 혼밥, 아점, 봉구스밥버거, 점저, 1인메뉴, 치즈떡갈비밥버거, 사무실"
"677876","마포구","양식, 핑거스테이크, Hola!감바스, 뉴욕에서온크림파스타치킨, 쉬림프볼케이노라이스, 1.50cm바게트브릿지"
"702610","강남구","양식, 퀘사디아, 타코"
"719368","동대문구","양식, 바베큐플레이트, 샐러드파스타"
"719572","동작구","일식·회, 아시안, 가라아게, 치킨"
"720405","송파구","일식·회, 양식, 돈가스, 우동"
"721382","성북구","한식, 낙지찜, 아구찜"
"735923","수원시 팔달구","한식, 한끼식사되는, 저녁에붐비는, 친구들이랑, 매콤, 음료판매, 저녁, 쭈삼꼬, 쭈삼이, 세트메뉴가있는, 한잔하고싶을때, 안주로딱좋은, 쭈꾸미삼겹살, 쭈꾸미, 밥볶아먹기좋은, 사리넣으면맛있는, 착한가격, 쫀득, 쫄깃쫄깃, 치즈가흐르는, 푸짐한"
"739609","관악구","고기, 한식, 입에서불나는, 회사동료랑, 얼큰고추장찌개, 고기성애자, 매콤, 회식, 직원이자신있어하는, 양푼이돼지김치찌개, 저녁, 주당, 오목찌개, 고퀄리티, 안주로딱좋은, 제육, 송년회, 따끈한, 데리야끼불백, 퇴근후, 푸짐한, 불맛, 김치찌개, 닭볶음탕, 매콤닭볶음탕"
"740790","수원시 영통구","디저트·커피, NEW, 감자고로케, 크림치즈고로케"
"742863","서초구","디저트·커피, 쉬폰케이크, 주말, 달콤, 음료판매, 친구들이랑, 티라미슈, 디저트홀릭, 인스타맛집, 베이커리, 우울할때, 여자들끼리, 브런치, 입맛없을때, 크레이프, 아메리카노, 고소한, 카페, 가벼운식사, 케이크, 연인끼리"
"743767","노원구","양식, 바삭바삭, 칠리치즈프라이, 깔끔, 저녁, 점심, 어니언버거, 육즙이흐르는, 고퀄리티, 치즈버거, 고급스러운, 수제버거, 착한가격, 미국식, 아메리칸푸드, 튀김덕후, 펍, 치즈가흐르는, 머쉬룸버거, 밀가루덕후, 연인끼리"
"752253","동대문구","고기, 한식, NEW, 달콤, 한끼식사되는, 밥집, 친구들이랑, 돈까스, 국밥성애자, 직원이자신있어하는, 점심, 저녁, 수제치즈돈까스, 아이와어른함께, 가성비갑, 함박스텍, 기사식당, 따끈한, TV맛집, 단골폭발, 짭짤한, 생선까스, 푸짐한, 이색맛집, 설렁탕, 집밥"
"753109","강서구","일식·회, NEW, 초밥, 정갈한, 회사동료랑, 재료가신선한, 친구들이랑, 입소문난, 속이풀리는, 해산물덕후, 촉촉, 혼마구로초밥, 가족식탁용, 일식전문, 탱글탱글"
"757584","수원시 영통구","한식, NEW, 콩비지찌개, 순두부찌개"
"758814","동작구","디저트·커피, 아삭아삭, 달콤, 여름, 음료판매, 친구들이랑, 이거저거다맛있음, 시원한, 디저트홀릭, 해쨍쨍, 망고치즈케이크빙수, 폭염, 레몬에이드, 스무디, 새콤, 힐링푸드, 빵, 간식, 아메리카노, 카페, 상큼"
"759134","성남시 분당구","null"
"776958","광진구","null"
"778121","강서구","분식, 디저트·커피, NEW, 아삭아삭, 밥집, 매콤, 점심, 깔끔, 베이커리, 부드러운, 김밥, 벌크샌드위치, 홈메이드스무디, 나들이, 가성비갑, 여자들끼리, 정갈한, 햄치즈샌드위치, 브런치, 샌드위치, 고소한, 사무실, 연인끼리"
"782889","성동구","일식·회, NEW, 연어초밥, 광어초밥"
"790928","영등포구","디저트·커피, 양식, NEW, 아보카도"
"791188","구로구","한식, NEW, 도가니탕, 곰탕"
"798324","강남구","한식, NEW, 도시락, 옛날치킨, 한강공원, 한끼식사되는, 바삭바삭, 밥집, 쌀덕후, 외국인친구랑, 점심, 깔끔, 소스가맛있는, 옛날도너츠, 나들이, 아이와어른함께, 정통한식, 짭짤한, 한식도시락, 고향의맛"
"801844","중구","null"
"36235","관악구","고기, 한식, 사무실, 주말, 고기성애자, 헤비한메뉴, 선선할때, 직원이자신있어하는, 저녁, 흥부족발, 퓨전한식, 내방, 나들이, 흥부특선, 향이좋은, 안주로딱좋은, 송년회, 남자들끼리, 흥부보쌈, 폭식하는날, 쫄깃쫄깃, 퇴근후, 보양식, 연중무휴, 레알인정"
"615126","양천구","분식, 치즈즉석볶음밥, 주말, 매콤, 모듬오뎅탕, 떡볶이, 속이든든한, 분식, 얼큰, 찬바람쌩쌩, 고고즉석떡볶이, 브런치, 자극적인, 착한가격, 간식, 동아리방, 이색맛집, 사리넣어먹으면맛있는, 입소문난, 선선할때, 짱맛, 꼬마김밥, 김밥, 캠퍼스안, 중독성쩔어, 치즈즉석떡볶이, 무침군만두, 힐링푸드, 매운음식덕후, 밥볶아먹기좋은, 쫄깃쫄깃, 야식"
"618551","부천시","아시안, 쌀쌀할때, 쌀국수, 밥집, 친구들이랑, 엄지척, 점심, 저녁, 이국적, 프랜차이즈, 또먹고싶다, 진한국물, 가성비갑, 속이든든한, 부담없는, 여자들끼리, 정갈한, 얼큰, 풍미가깊은, 찬바람쌩쌩, 저칼로리, 깐풍기, 면덕후, 퇴근후, 숙취해소, 점저, 맛점"
"678772","마포구","양식, 음료판매, 저녁, 스테이크, 리코타치즈샐러드, 향이좋은, 목살필라프, 페퍼로니피자, 씨푸드토마토, TV맛집, 새우리소토, 착한가격, 푸짐한, 연인끼리, 꿀맛, 이탈리안레스토랑, 점심, 드레싱이맛있는, 가성비갑, 피자, 풍미가깊은, 재료가신선한, 고급스러운, 따끈한, 대박, 데미소스찹스테이크, 고소한, 분위기낼때, 담백"
"679074","마포구","고기, 한식, 주말, 꿀맛, 밥집, 음료판매, 매콤, 점심, 저녁, 옹밥, 치즈찜닭, 진한국물, 향이좋은, 육즙이흐르는, 동창모임, 재료가신선한, 순살치즈찜닭, 찜닭, TV맛집, 신홍초찜닭, 밥볶아먹기좋은, 따끈한, 사리넣으면맛있는, 건강해지는느낌, 옹다래찜닭, 푸짐한, 보양식, 졸맛"
"680079","영등포구","한식, 쌀쌀할때, 계란말이, 저녁에붐비는, 밥집, 입소문난, 매콤, 짱맛, 눈오는날, 진한국물, 속이든든한, 중독성쩔어, 힐링푸드, 얼큰, 매운음식덕후, 사리넣으면맛있는, 단골폭발, 착한가격, 쫄깃쫄깃, 과방, 김치조치, 김치찌개, 집밥, 사무실, 고향의맛"
"686204","강남구","고기, 한식, 연인끼리, 주말, 한강공원, 밥집, 고기성애자, 엄지척, 직원이자신있어하는, 저녁, 갈비백탕, 퓨전한식, 고기굽기조절가능, 고퀄리티, 육즙이흐르는, 동창모임, 갈비탕, 송년회, 갈비찜누룽밥, 대박, 퇴근후, 기름진, 육회비빔밥, 한우차돌볶음밥, 동아리방, 푸짐한, 연중무휴, 사무실, 갈비홍탕"
"690425","서초구","한식, 모듬수육전골, 한판보쌈, 전통육개장, 사골떡만두국, 육개장칼국수, 차돌박이육개장"
"693152","성북구","디저트·커피, 브레이크타임있는, 한끼식사되는, 매콤, 저녁, 존맛, 집에서데이트, 내방, 청포도에이드, 속이든든한, 여자들끼리, 사르르녹는, 혼밥, 팔칠올인박스, 동아리방, 푸짐한, 모짜렐라고로케, 집밥, 사무실, 연인끼리, 꿀맛, 썸남썸녀랑, 덮밥덕후, 밥집, 호두단팥고로케, 점심, 게살통통고로케, 가족식탁용, 아이와어른함께, 가성비갑, 고퀄리티, 부담없는, 매운음식덕후, 점심에붐비는, 고로케, 과방, 숨겨진맛집, 피자고로케, 연중무휴"
"700280","강남구","양식, 브리또, 타코"
"718746","동작구","한식, 닭볶음탕, 소불고기"
"726707","성남시 분당구","디저트·커피, 샐러드, 샌드위치"
"730629","마포구","한식, 바삭바삭, 국물떡볶이, 친구들이랑, 음료판매, 불닭볶음밥, 모래집튀김, 저녁, 스트레스풀자, 튀김, 내방, 한잔하고싶을때, 가성비갑, 안주로딱좋은, 깐풍치킨, 짭짤한, 칼칼한, 야식, 맛있게매운, 깐풍모래집튀김, 탱글탱글, 치킨, 옛날통닭, 포차"
"730699","수원시 영통구","일식·회, 아시안, 수제함바그카레라이스, 덮밥덕후, 친구들이랑, 매콤, 규동, 깔끔, 사시사철, 카레전문, 세트메뉴가있는, 치킨세트, 일본느낌, 가라아게마요동, 돈부리, 따끈한, 해산물세트, 카레, 점심에붐비는, 입맛없을때, 포크세트, 토핑이다양한, 푸짐한, 런치세트, 연인끼리"
"731624","성북구","한식, 마라, 꿔바로우"
"733870","부평구","일식·회, 고기, 로스까스, 재주문욕구, 썸남썸녀랑, 해산물덕후, 깔끔, 참치회덮밥, 가성비갑, 부담없는, 입에서순삭, 초밥, 갓스시, 적당한, 사르르녹는, 입맛없을때, 튀김덕후, 튀김우동, 일식전문, 탱글탱글, 가츠동, 맛점, 연인끼리"
"736134","성남시 분당구","일식·회, 초밥, 사시미"
"741758","강동구","디저트·커피, 아이스크림, 케이크"
"744581","종로구","null"
"746118","도봉구","양식, 파스타, 스테이크"
"752698","부천시","디저트·커피, 아이스크림, 아이스크림케이크"
"753382","용산구","한식, NEW, 주말, 묵은지김치찜, 바삭바삭, 김치찜, 외국인친구랑, 항정살구이, 쫄면, 퓨전한식, 주당, 스트레스풀자, 내방, 한잔하고싶을때, 편맥과함께, 비쥬얼, 안주로딱좋은, 차돌박이짬뽕탕, 적당한, 짭짤한, 숙회, 분위기낼때, 포차"
"761544","서초구","고기, 양식, 경양식, 한끼식사되는, 고기성애자, 친구들이랑, 꽃등심스테이크, 티본스테이크, 점심, 촉촉, 스테이크, 집에서데이트, 스트레스풀자, 육즙이흐르는, 따끈한, 안심스테이크, 짭짤한, 아메리칸푸드, 미국식, 엘본스테이크, 불맛, 등심스테이크, 연인끼리"
"764435","용산구","디저트·커피, 양식, NEW, 토마토모짜렐라샌드위치, 주말, 건강빵, 속이풀리는, 이국적, 디저트홀릭, 베이커리, 빵덕후, 피셔맨샌드위치, 여자들끼리, 빵집, TV맛집, 브런치, 수제버거, 샌드위치, 카페, 분위기낼때, 현지인운영, 연인끼리"
"774135","마포구","양식, NEW, 치킨마크니, 바삭바삭, 매콤, 회식, 샐러드, 소스가맛있는, 이국적, 육즙이흐르는, 특이한메뉴, 라씨, 정갈한, 고급스러운, 쫄깃쫄깃, 인도음식, 탄두리치킨, 이색맛집, 불맛, 고소한, 치킨, 연인끼리"
"774662","성북구","한식, 찌개, 철판볶음"
"776299","영등포구","일식·회, NEW, 회, 활어회"
"776878","동대문구","한식, NEW, 제육, 불고기"
"780239","서초구","아시안, NEW, 주말, 회사동료랑, 분짜, 쌀국수, 양지쌀국수, 입소문난, 점심, 깔끔, 이국적, 넴, 맑은국물, 향이좋은, 고퀄리티, 동남아음식, 불고기쌀국수, 여자들끼리, 국물덕후, 따끈한, 볶음밥, 고소한, 차돌쌀국수, 담백"
"795361","수원시 권선구","디저트·커피, NEW, 망고스무디, 프라페, 달콤, 음료판매, 입소문난, 직원이자신있어하는, 이국적, 디저트홀릭, 집에서데이트, 블루레몬에이드, 폭염, 특이한메뉴, 여자들끼리, 점심에붐비는, 간식, 샌드위치, 아메리카노, 빙수, 카페, 고소한"
"796498","성남시 분당구","null"
"797381","광진구","디저트·커피, 양식, NEW, 피자, 케이크"
"799723","마포구","null"
"802127","서초구","null"
"802286","서초구","null"
"607898","동작구","고기, 한식, 단짠단짠, 주말, 엄지척, 매콤, 저녁, 부드러운, 동태탕, 얼리먹답터, 비쥬얼, 속이든든한, 생선구이정식, 정통한식, 남자들끼리, 황태해장국, 푸짐한, 집밥, 맛점, 졸맛, 바삭바삭, 밥집, 입소문난, 점심, 가족식탁용, 참가자미무침, 고퀄리티, 중독성쩔어, 정갈한, 퇴근후, 명태조림, 런치세트, 숨겨진맛집, 갓집밥, 취향저격"
"615301","송파구","고기, 한식, 주말, 쌀쌀할때, 비오는날, 간장게장, 저녁에붐비는, 회식, 사시사철, 점심, 내방, 가족식탁용, 아구찜, 낙지볶음, 간장새우, 동창모임, 얼큰, 매운음식덕후, 재료가신선한, 폭식하는날, 해물찜, 푸짐한, 숨겨진맛집, 숙취해소, 보양식, 사무실, 레알인정"
"617042","고양시 일산서구","한식, 닭볶음탕, 담백, 쌀쌀할때, 겨울, 한끼식사되는, 해물파전, 회식, 국밥성애자, 점심, 저녁, 아이와어른함께, 진한국물, 가정식, 안주로딱좋은, 동창모임, 정통한식, 얼큰, 남자들끼리, 저칼로리, 안주가맛있는, 야식, 혼밥, 24시간영업, 숙취해소, 연중무휴, 보양식, 연인끼리"
"620662","강남구","분식, 진미김밥, 간이약한, 달콤, 한끼식사되는, 친구들이랑, 매콤, 쌀덕후, 저녁, 철판제육덮밥, 부드러운, 비쥬얼, 속이든든한, 육즙이흐르는, 분식, 여자들끼리, 얼큰, 남자들끼리, 면덕후, 매운제육쌈김밥, 푸짐한, 집밥, 크림치즈김밥, 1인메뉴, 사무실, 연인끼리, 경양식, 바삭바삭, 덮밥덕후, 사시사철, 점심, 시원한, 아이와어른함께, 가성비갑, 부담없는, 꿀조합, 따끈한, 제육쌈김밥, 간편하게먹기, 쫀득, 쫄깃쫄깃, 김선생비빔면, 연중무휴, 갓집밥, 담백"
"624149","용산구","양식, 이태원버거, 음료판매, 입소문난, 사시사철, 핵폭탄버거, 낮술, 이국적, 가성비갑, 육즙이흐르는, 속이든든한, 여자들끼리, 재료가신선한, 남자들끼리, TV맛집, 대박, 자이언트루터버거, 미국식, 아메리칸푸드, 갓버거, 루터버거, 치즈가흐르는, 푸짐한, 연중무휴, 졸맛"
"652644","송파구","일식·회, 쌀쌀할때, 저녁에붐비는, 탄성자동발사, 입소문난, 회식, 사시사철, 저녁, 동태한마리탕, 내방, 가족식탁용, 고퀄리티, 간장새우, 입에서순삭, 힐링푸드, 참가자미세꼬시, 송년회, 재료가신선한, 따끈한, 갓스시, 문어숙회, 사르르녹는, 일식전문, 보양식, 담백"
"668815","강남구","디저트·커피, 달콤, 여름, 음료판매, 부드러운, 메리뉴욕, 프랜차이즈, 착한가격, 간식, 동아리방, 카페, 상큼, 사무실, 연인끼리, 민트초코칩요프치노, 꿀맛, 베리베리요거트빙수, 썸남썸녀랑, 블루베리생크림오믈렛한박스, 시원한, 디저트홀릭, 스트로베리프루티, 메리망고, 세트메뉴가있는, 폭염, 부담없는, 스무디, 가볍게먹기좋은, 빙수"
"675541","강동구","디저트·커피, 꿀맛, 달콤, 친구들이랑, 새우토스트mvp, 사시사철, 베이컨치즈베이글, 빵덕후, 프랜차이즈, 드레싱이맛있는, 햄스페셜토스트, 가성비갑, 캠퍼스안, 중독성쩔어, 입에서순삭, 분식, 따끈한, 불갈비토스트mvp, 착한가격, 딸기주스, 혼밥, 아점, 간식, 과방, 치즈가흐르는, 토스트, 고소한, 가벼운식사"
