"shop_no","rgn2_nm","content"
"677746","마포구","일식·회, 아시안, 주말, 쌀쌀할때, 꿀맛, 겨울, 바삭바삭, 음료판매, 매콤, 입소문난, 카라아게OMU, 점심, 저녁, 치킨크림OMU, 세트메뉴가있는, 라이트야채치킨카레, 향이좋은, 치킨카레, 고퀄리티, 속이든든한, 일본느낌, 여자들끼리, 풍미가깊은, 매운음식덕후, 재료가신선한, 따뜻한, 치킨크림오믈렛"
"710099","성북구","디저트·커피, 샌드위치, 커피"
"727165","고양시 일산동구","아시안, 쌀국수, 팟타이"
"729946","부평구","디저트·커피, 양식, 연인끼리, 유럽식, 이탈리안레스토랑, 선선할때, 소스가맛있는, 부드러운, 스테이크, 그릴소시지피자, 리코타치즈샐러드, 찹스테이크, 비쥬얼, 홈메이드, 파스타, 기념일, 적당한, 해물파스타, 치즈가흐르는, 고소한, 분위기낼때, 밀가루덕후, 담백"
"731383","영등포구","고기, 한식, 직화제육, 직화오징어볶음"
"732265","수원시 영통구","고기, 한식, 보쌈, 여름, 겨울, 매운족발, 주당, 한잔하고싶을때, 가족식탁용, 아이와어른함께, 가성비갑, 고퀄리티, 육즙이흐르는, 안주로딱좋은, 매운미니족, 홍어삼합, 족발, 냉채족발, 재료가신선한, 착한가격, 쫄깃쫄깃, 고소한, 탱글탱글, 담백"
"735076","동작구","디저트·커피, 양식, 한끼식사되는, 바삭바삭, 매콤, 낮술, 이국적, 비쥬얼, 육즙이흐르는, 수제버거, 감자튀김, 짭짤한, 아메리칸푸드, 소세지, 미국식, 아메리카노, 치즈가흐르는, 푸짐한, 불맛, 맛점, 연인끼리"
"738126","서초구","한식, 낙지비빔밥, 동지팥죽, 밥집, 나물비빔밥, 해물모듬죽, 점심, 깔끔, 단호박죽, 내방, 속이든든한, 힐링푸드, 홈메이드, 비빔밥, 재료가신선한, 따끈한, 입맛없을때, 혼밥, 건강해지는느낌, 집밥, 죽, 사무실, 보양식"
"738501","서대문구","디저트·커피, 아이스크림, 케이크"
"738920","강북구","고기, 한식, 아삭아삭, 비오는날, 계란말이, 매콤, 친구들이랑, 오돌뻐, 닭발, 주당, 한잔하고싶을때, 한신닭발, 안주로딱좋은, 매운음식덕후, 통닭, 따끈한, 짭짤한, 칼칼한, 맛있게매운, 탱글탱글, 불맛, 포차"
"745606","성북구","일식·회, 초밥, 우동"
"754597","부천시","디저트·커피, NEW, 아이스크림, 젤라또"
"756897","강남구","디저트·커피, NEW, 베이컨햄치즈샌드위치, 아보카도라떼, 망고프레페, 큐브라떼, 샐러드, 샌드위치, 토스트, 라떼"
"760924","강남구","한식, NEW, 회사동료랑, 밥집, 친구들이랑, 치즈닭갈비철판, 속이풀리는, 점심, 우삼겹부대, 가성비갑, 원조, 얼큰, 국물덕후, 간편하게먹기, 사리넣으면맛있는, 토핑이다양한, 부대찌개, 부대전골, 닭갈비철판, 런치세트, 밥말아먹기좋은"
"765229","강남구","양식, NEW, 치킨샐러드, 목살라이스"
"775117","계양구","고기, 한식, NEW, 제육볶음, 감자탕"
"776781","도봉구","아시안, NEW, 쌀국수, 볶음밥"
"777683","종로구","분식, NEW, 치즈가워터파크, 분식덕후, 튀김세트, 매콤, 소스가맛있는, 꼬마김밥, 아이와어른함께, 떡볶이, 분식, 따끈한, 오뎅, 쫄깃쫄깃, 튀김덕후, 혼밥, 간식, 떡성애자, 고소한, 탱글탱글, 가벼운식사, 찰순대"
"779970","부천시","디저트·커피, NEW, 와플, 아메리카노"
"607103","서초구","분식, 부반장떡볶이, 도시락, 주말, 취향저격, 한끼식사되는, 바삭바삭, 친구들이랑, 매콤, 사시사철, 점심, 저녁, 필링푸드, 세트메뉴가있는, 프랜차이즈, 반장떡볶이, 떡볶이, 가성비갑, 분식, 여자들끼리, 테이스티로드, 따끈한, TV맛집, 자극적인, 쫄깃쫄깃, 떡성애자, 연인끼리"
"631574","서초구","한식, 얼큰설렁탕, 보양식, 도가니탕, 겨울, 꿀맛, 비오는날, 밥집, 국밥성애자, 점심, 프랜차이즈, 수만두, 또먹고싶다, 진한국물, 속이든든한, 동창모임, 풍미가깊은, 찬바람쌩쌩, 송년회, 남자들끼리, 따끈한, 혼밥, 고소한, 설렁탕, 숙취해소, 1인메뉴, 사무실, 고향의맛"
"634936","동작구","분식, 달콤, 한끼식사되는, 매콤, 저녁, 새우튀김, 카레돈가스, 김치돈가스, 착한가격, 혼밥, 푸짐한, 등심돈가스, 빨리먹을수있는, 졸맛, 꿀맛, 저녁에붐비는, 밥집, 입소문난, 점심, 제육등심, 세트메뉴가있는, 가성비갑, 부담없는, 재료가신선한, 따끈한, 점심에붐비는, 간편하게먹기, 단골폭발, 쫄깃쫄깃, 소세지"
"644145","강서구","디저트·커피, 취향저격, 달콤, 여름, 음료판매, 친구들이랑, 저녁, 해쨍쨍, 프랜차이즈, 인절미설빙, 웨이팅긴곳, 비쥬얼, 특이한메뉴, 입에서순삭, 여자들끼리, 사르르녹는, 간식, 카페, 빨리먹을수있는, 레알인정, 연인끼리, 꿀맛, 썸남썸녀랑, 점심, 깔끔, 시원한, 폭염, 아이와어른함께, 드레싱이맛있는, 우유팥빙수, 인절미빙수, 힐링푸드, 가볍게먹기좋은, 간편하게먹기, 연중무휴, 담백"
"666907","용산구","일식·회, 심야식당, 덮밥덕후, 명란마요야끼규동, 밥집, 매콤, 규동, 점심, 깔끔, 가정식, 치즈매운야끼규동, 얼큰니꾸우동, 치즈야끼규동, 가볍게먹기좋은, 간편하게먹기, 착한가격, 혼밥, 아점, 가츠카레, 숨겨진맛집, 김치치즈가츠동"
"674945","관악구","분식, 음료판매, 친구들이랑, 매콤, 저녁, 내방, 또먹고싶다, 향이좋은, 안주로딱좋은, 분식, 아메리칸푸드, 닭꼬치, 간식, 치킨버거, 카페, 빨리먹을수있는, 심야식당, 고기성애자, 사시사철, 깔끔, 소스가맛있는, 이국적, 혼술, 수제소시지, 촉촉, 편맥과함께, 캠퍼스안, 중독성쩔어, 부담없는, 매운음식덕후, 가볍게먹기좋은, 대박, 간편하게먹기, 야구장, 야식, 소시지, 불맛, 수제소시지버거, 숨겨진맛집, 버거"
"700904","중랑구","한식, 이태원감자전, 차돌떡볶이, 블랙닭도리탕, 날치알주먹밥, 갈비부추, 닭도리탕, 떡볶이"
"704517","구로구","일식·회, 한식, 주말, 달콤, 회식, 선선할때, 직원이자신있어하는, 사시사철, 저녁, 해산물덕후, 부드러운, 세트메뉴가있는, 가족식탁용, 향이좋은, 비쥬얼, 고퀄리티, 입에서순삭, 풍미가깊은, 재료가신선한, 고급스러운, TV맛집, 대게, 기념일, 적당한, 일식전문, 고소한, 보양식, 홍게찜"
"714017","성남시 분당구","양식, 피자, 감자튀김, 피맥"
"715077","마포구","디저트·커피, 재주문욕구, 바닐라라떼, 모카, 친구들이랑, 입소문난, 사시사철, 점심, 깔끔, 하이엔드, 디저트홀릭, 부드러운, 라떼, 여자들끼리, 착한가격, 간식, 아메리카노, 카페, 분위기낼때, 연인끼리"
"720858","성동구","한식, 수제비, 닭갈비"
"725731","관악구","한식, 쭈꾸미, 날치알볶음밥"
"726669","수원시 팔달구","일식·회, 광어초밥, 한끼식사되는, 친구들이랑, 해산물덕후, 깔끔, 저녁, 특선초밥, 한잔하고싶을때, 가성비갑, 입에서순삭, 연어초밥, 정갈한, 재료가신선한, 남자들끼리, 갓스시, 참치모듬초밥, 일식전문, 탱글탱글, 참치초밥, 맛점, 담백"
"729836","노원구","일식·회, 연어회, 모듬초밥, 한끼식사되는, 친구들이랑, 돈까스, 해산물덕후, 깔끔, 촉촉, 고퀄리티, 일본느낌, 가을, 연어초밥, 초밥, 정갈한, 재료가신선한, 갓스시, 사시미, 모듬회, 일식전문, 탱글탱글, 숨겨진맛집, 담백"
"733939","강북구","아시안, 양식, 연인끼리, 쌀국수, 깔끔, 저녁, 월남쌈, 이국적, 나시고랭, 가성비갑, 동남아음식, 여자들끼리, 국물덕후, 따끈한, 간편하게먹기, 면덕후, 팟타이, 착한가격, 볶음밥, 가벼운식사, 맛점, 담백"
"743388","서초구","양식, 회사동료랑, 치즈가워터파크, 한끼식사되는, 바삭바삭, 친구들이랑, 패스트푸드, 육즙이흐르는, 브런치, 간편하게먹기, 짭짤한, 아메리칸푸드, 혼밥, 치즈가흐르는, 비프버거, 치킨버거, 이색맛집, 피쉬버거, 맛점, 버거"
"750948","강서구","null"
"762809","서초구","디저트·커피, NEW, 바닐라라떼, 한강공원, 음료판매, 점심, 샐러드, 디저트홀릭, 치킨베이컨샐러드, 소시지샌드위치, 내방, 카페라떼, 가볍게먹기좋은, 브런치, 간편하게먹기, 착한가격, 짭짤한, 혼밥, 샌드위치, 치즈가흐르는, 고소한, 카페, 모짜렐라바질샌드위치"
"775940","강서구","분식, 한식, NEW, 고기만두, 왕만두, 분식덕후, 한끼식사되는, 매콤, 아이와어른함께, 향이좋은, 가성비갑, 분식, 찐빵, 따끈한, 간편하게먹기, 만두, 김치만두, 짭짤한, 혼밥, 옥수수술빵, 오징어만두, 빨리먹을수있는, 고향의맛"
"780345","부평구","양식, NEW, 수제버거, 치킨버거"
"791804","마포구","일식·회, NEW, 초새우, 사시미"
"792078","강남구","디저트·커피, NEW, 쉐이크, 아메리카노"
"794112","부평구","한식, NEW, 설농탕, 순사골국"
"794788","서초구","null"
"801168","중구","null"
"575245","강남구","고기, 한식대첩, 고기사랑, 취향저격, 유동골뱅이무침, 달콤, 고추치킨, 친구들이랑, 매콤, 회식, 저녁, 부드러운, 육즙이흐르는, 안주로딱좋은, 착한가격, 기름진, 푸짐한, 밀가루덕후, 레알인정, 연인끼리, 고추튀김, 바삭바삭, 고기성애자, 입소문난, 중독성쩔어, 부담없는, 매운음식덕후, 따끈한, 감자튀김, 치맥, 포차, 담백"
"614598","강남구","양식, 주말, 한끼식사되는, 탄성자동발사, 입소문난, 칠리치즈나쵸, 점심, 저녁, 얼리먹답터, 웨이팅긴곳, 가성비갑, 고퀄리티, 속이든든한, 부담없는, 특이한메뉴, 여자들끼리, 풍미가깊은, 재료가신선한, 남자들끼리, 간편하게먹기, 기념일, 사르르녹는, 치즈가흐르는, 분위기낼때, 리코타토스타다, 레알인정, 연인끼리"
"617201","송파구","디저트·커피, 요거트쉐이크, 레몬과일청소다, 에그햄치즈샌드위치"
"630710","서초구","양식, 치즈피자, 주말, 치즈가워터파크, 음료판매, 시카고피자, 저녁, 비쥬얼, 여자들끼리, 닭가슴살샐러드, 사르르녹는, 치즈오븐스파게티, 밀가루덕후, 상큼, 연인끼리, 꿀맛, 쉬림프시카고피자, 이탈리안레스토랑, 입소문난, 사시사철, 촉촉, 피맥, 세트메뉴가있는, 오리지날시카고피자, 살라미햄시카고피자, 꿀조합, 재료가신선한, 쫄깃쫄깃, 닭가슴살매콤크림스파게티, 고소한"
"632643","서초구","디저트·커피, 패밀리, 달콤, 여름, 음료판매, 친구들이랑, 부드러운, 해쨍쨍, 프랜차이즈, 비쥬얼, 입에서순삭, 하프갤론, 여자들끼리, 아이스크림, 기념일, 간식, 혼디, 카페, 졸맛, 사무실, 아이스크림케익, 상큼, 시원한, 폭염, 봄, 쿼터, 가성비갑, 부담없는, 가볍게먹기좋은, 세젤맛, 버라이어티팩, 초코덕후, 꿀조합, 배민딜리버리팩, 과방, 파인트"
"653231","강남구","한식, 밥집, 친구들이랑, 선선할때, 모짜렐라부대볶음, 점심, 저녁, 부대볶음, 퓨전한식, 몽골리안비프, 프랜차이즈, 내방, 가족식탁용, 진한국물, 속이든든한, JVL부대찌개, 부담없는, 여자들끼리, 사리넣으면맛있는, 우삼겹철판구이, 맛있으면0칼로리, 해비한메뉴, 과방, 부대찌개, 숙취해소, 그릴소시지, 사무실"
"671610","강동구","디저트·커피, 치즈가워터파크, 친구들이랑, 선선할때, 사시사철, 야채핫도그, 직원이자신있어하는, 서울버켓, 핫도그, 짱맛, 프랜차이즈, 내방, 아이와어른함께, 중독성쩔어, 입에서순삭, 가볍게먹기좋은, 빵집, 따끈한, 서울핫도그, 치즈핫도그, 기름진, 간식, 아점, 빨리먹을수있는, 사무실, 밀가루덕후"
"681472","송파구","null"
"687714","동대문구","고기, 한식, 얼큰설렁탕, 취향저격, 저녁, 프랜차이즈, 또먹고싶다, 맑은국물, 진한국물, 속이든든한, 찬바람쌩쌩, 남자들끼리, 혼밥, 푸짐한, 설렁탕, 집밥, 보양식, 졸맛, 도가니탕, 쌀쌀할때, 비오는날, 겨울, 밥집, 국밥성애자, 점심, 깔끔, 수만두, 아이와어른함께, 부담없는, 풍미가깊은, 따끈한, 점심에붐비는, 퇴근후, 숙취해소, 담백"
"692490","중랑구","일식·회, 한끼식사되는, 저녁, 내방, 일본느낌, 돈부리, 규동셋트, 혼밥, 새우카라아게, 집밥, 꿀맛, 덮밥덕후, 밥집, 카레셋트, 선선할때, 사케동셋트, 점심, 깔끔, 혼술, 치킨마요셋트, 편맥과함께, 가정식, 가성비갑, 캠퍼스안, 풍미가깊은, 재료가신선한, 따끈한, 단골폭발, 치킨카라아게, 갓집밥"
"700711","서대문구","일식·회, 썸남썸녀랑, 밥집, 메밀소바, 돈까스, 입소문난, 안심돈카츠, 점심, 선선할때, 치즈돈카츠, 카츠샌드, 내방, 아이와어른함께, 등심돈카츠, 속이든든한, 캠퍼스안, 중독성쩔어, 일본느낌, 입에서순삭, 여자들끼리, 커리돈카츠, 튀김덕후, 과방, 시그니처, 일식전문, 고소한, 바사바삭, 사무실"
"712594","성남시 분당구","한식, 육식인간, 겨울, 밥집, 헤비한메뉴, 저녁, 순대국, 내방, 가족식탁용, 진한국물, 국물덕후, 따끈한, 백반, 기름진, 전골, 푸짐한, 집밥, 맛집사냥꾼, 보양식, 고향의맛"
"717175","성남시 분당구","한식, 밀푀유나베, 고기성애자, 스테이크"
"717930","광진구","아시안, 쌀국수, 월남쌈"
"729535","수원시 팔달구","한식, 보쌈, 족발"
"729855","서대문구","고기, 왕갈비탕, 소갈비찜"
"733021","강남구","디저트·커피, 회사동료랑, 달콤, 친구들이랑, 입소문난, 깔끔, 시원한, 디저트홀릭, 폭염, 향이좋은, 비쥬얼, 여자들끼리, 찬바람쌩쌩, 브런치, 간식, 아메리카노, 밀크티, 카페, 연유라떼, 연인끼리"
"734230","강남구","한식, 아삭아삭, 고기성애자, 직원이자신있어하는, 저녁, 이국적, 갈릭볶음밥, 퓨전한식, 비쥬얼, 육즙이흐르는, 동남아음식, 딤섬, 특이한메뉴, 여자들끼리, 돼지고기, 연어, 덮밥, 푸짐한, 소고기, 치킨, 맛집사냥꾼, 맛점, 밥말아먹기좋은, 연인끼리"
"734947","성남시 분당구","한식, 국수, 만두"
"735762","송파구","디저트·커피, 여름, 음료판매, 버블에이드, 시원한, 디저트홀릭, 짱맛, 폭염, 하동녹차쉐이크, 입에서순삭, 여자들끼리, 착한가격, 쫀득, 입맛없을때, 간식, 버블티, 밀크티, 탱글탱글, 카페, 토핑이다양한"
"738954","부평구","고기, 한식, 순대, 순대국밥"
"742800","강남구","한식, 특곰탕, 도가니탕, 왕만두, 회사동료랑, 쌀쌀할때, 밥집, 곰탕, 왕갈비곰탕, 속이풀리는, 직원이자신있어하는, 깔끔, 저녁, 맑은국물, 속이든든한, 남자들끼리, 따끈한, 양지곰탕, 우거지국밥, 푸짐한, 집밥, 맛점, 밥말아먹기좋은"
"743622","송파구","양식, 버터크루아상, 블랙머쉬룸파니니, 한강공원, 한끼식사되는, 여름, 건강빵, 양베치파니니, 압구정식빵, 직원이자신있어하는, 베이커리, 버터프레첼, 크로와상, 봄, 나들이, 가족식탁용, 고퀄리티, 재료가신선한, 파니니, 브런치, 데리야끼치킨파니니, 건강해지는느낌, 맛점, 밀가루덕후, 연인끼리"
"746741","구로구","한식, 비빔밥, 냉면"
"749637","부천시","디저트·커피, 양식, NEW, 샐러드, 연어샐러드"
"752695","부평구","디저트·커피, 아이스크림, 아이스크림케이크"
"754295","서초구","한식, NEW, 제육볶음, 갈비, 간장갈비찜"
"762618","동작구","한식, 찜, 매운등갈비찜, 밥집, 국밥성애자, 속이풀리는, 초복중복말복, 해쨍쨍, 폭염, 진한국물, 소보탕전골, 등갈비김치찜, 속이든든한, 국물덕후, 직화무뼈닭발, 따끈한, 칼칼한, 전골, 직화불닭발, 국물닭발, 숨겨진맛집, 보양식, 밥말아먹기좋은, 고향의맛"
"762816","강서구","한식, NEW, 아삭아삭, 비오는날, 간장게장, 밥집, 콩나물아구찜, 매콤, 선선할때, 해산물덕후, 주당, 아구찜, 간장새우, 아구맑은탕, 안주로딱좋은, 아구매운탕, 매운탕, 매운음식덕후, TV맛집, 쫄깃쫄깃, 칼칼한, 맛있게매운, 푸짐한, 시래기아구찜, 고향의맛"
"778667","영등포구","디저트·커피, 양식, NEW, 그릴치킨샐러드, 아삭아삭, 회사동료랑, 채식주의자, 소불고기샐러드, 깔끔, 샐러드, 점심, 두부버섯샐러드, 다이어터, 새우샐러드, 리코타치즈샐러드, 드레싱이맛있는, 샐러드바, 유기농, 여자들끼리, 재료가신선한, 착즙주스, 브런치, 건강해지는느낌, 고소한, 운동후"
"786442","동대문구","아시안, NEW, 치킨덮밥, 회덮밥"
"789560","송파구","양식, NEW, 파스타, 버거"
"790109","부평구","고기, 한식, NEW, 우삼겹부대찌개, 부대찌개"
"791300","강북구","고기, 한식, NEW, 제육볶음, 불고기백반"
"616312","부천시","아시안, 주말, 스모크치킨카레라이스, 꿀맛, 한끼식사되는, 음료판매, 치킨탄두리, 매콤, 사시사철, 점심, 버터치킨과난, 부드러운, 세트메뉴가있는, 나들이, 진한국물, 양고기마살라와난, 가성비갑, 여자들끼리, 홈메이드, 매운음식덕후, 착한가격, 인도음식, 고소한, 런치세트, 분위기낼때, 연인끼리"
"618750","송파구","디저트·커피, 패밀리, 달콤, 여름, 해쨍쨍, 프랜차이즈, 하프갤론, 여자들끼리, 아이스크림, 사르르녹는, 혼밥, 간식, 동아리방, 카페, 상큼, 사무실, 꿀맛, 시원한, 아이와어른함께, 쿼터, 가성비갑, 캠퍼스안, 가볍게먹기좋은, 버라이어티팩, 초코덕후, 간편하게먹기, 쫀득, 아이스크림케이크, 파인트"
"629011","강남구","디저트·커피, 양식, 한끼식사되는, 칠리콘까르네치즈프라이, 매콤, 직원이자신있어하는, 칠리치즈프라이즈, 특이한메뉴, 착한가격, 갓버거, 혼밥, 간식, 아점, 동아리방, 빨리먹을수있는, 레알인정, 밀가루덕후, 졸맛, 연인끼리, 썸남썸녀랑, 입소문난, 점심, 깔끔, 빵덕후, 가성비갑, 고퀄리티, 부담없는, 재료가신선한, 점심에붐비는, 단골폭발, 버거"
"649905","용산구","한식, 밥집, 매콤, 회식, 선선할때, 직원이자신있어하는, 점심, 저녁, 육개장, 국밥성애자, 한방보쌈, 내방, 가족식탁용, 진한국물, 가정식, 속이든든한, 얼큰, 재료가신선한, 따끈한, 육개장설렁탕, 옛날전통육개장, 점심에붐비는, 설렁탕, 숨겨진맛집, 집밥, 갓집밥, 사무실, 졸맛"
"650840","관악구","한식, 엄지척, 친구들이랑, 속이풀리는, 저녁, 해쨍쨍, 도토리묵육개장, 속이든든한, 도토리들깨수제비, 도토리들깨칼국수, 도토리묵육개장칼국수, 찬바람쌩쌩, 면덕후, 착한가격, 혼밥, 집밥, 밥집, 채식주의자, 입소문난, 사시사철, 점심, 낮술, 깔끔, 아이와어른함께, 부담없는, 재료가신선한, 도토리비빔냉면, 도토리묵황태해장국, 건강해지는느낌, 담백"
"666585","강남구","디저트·커피, 한강공원, 여름, 음료판매, 직원이자신있어하는, 테라로사아메리카노, 레몬히비스커스플라워티, 여자들끼리, 홈메이드, 저칼로리, 스윗그린, 혼밥, 간식, 아메리카노, 카페, 사무실, 상큼, 점심, 샐러드, 시원한, 폭염, 고퀄리티, 캠퍼스안, 힐링푸드, 다크리브레아메리카노, 가볍게먹기좋은, 재료가신선한, 건강해지는느낌, 취향저격"
"669583","서초구","일식·회, 한식, 아삭아삭, 꿀맛, 바삭바삭, 음료판매, 새우가츠카레, 친구들이랑, 돈까스, 믹스가츠동, 점심, 깔끔, 탄성자동발사, 세트메뉴가있는, 진한국물, 속이든든한, 육즙이흐르는, 냉소바, 안주로딱좋은, 수제돈가츠, 치즈돈가츠, 찬바람쌩쌩, 재료가신선한, 점심에붐비는, 착한가격, 혼밥, 치즈가흐르는, 일식전문, 담백"
"672889","영등포구","아시안, 기분내기, 똠양볶음밥, 저녁, 프랜차이즈, 내방, 맑은국물, 진한국물, 향이좋은, 가을, 해산물팟타이, 팟타이, 이색맛집, 차돌쌀국수, 사무실, 연인끼리, 레알인정, 해산물볶음쌀국수, 쌀쌀할때, 꿀맛, 쌀국수, 저녁에붐비는, 밥집, R9숯불구이볶음밥, 점심, 이국적, 짱맛, 가족식탁용, R3하노이볶음밥, 아이와어른함께, 점심에붐비는, 건강해지는느낌, 따근한, 담백"
"685307","광진구","한식, 주말, 엄지척, 친구들이랑, 해산물덕후, 저녁, 프랜차이즈, 비쥬얼, 간장새우, 안주로딱좋은, 남자들끼리, 두부보쌈김치, 안주가맛있는, 푸짐한, 졸맛, 연인끼리, 회사동료랑, 보쌈, 해물파전, 저녁에붐비는, 고기성애자, 탄성자동발사, 꼬막살초무침, 주당, 부담없는, 쫀득, 퇴근후, 짭짤한, 포차, 취향저격"
"692486","중랑구","디저트·커피, 주말, 꿀맛, 썸남썸녀랑, 달콤, 입소문난, 수제소시지핫도그, 빵덕후, 아이와어른함께, 향이좋은, 가성비갑, 에그샌드위치, 힐링푸드, 가볍게먹기좋은, 따끈한, 카스테라, 닭가슴살샐러드, 먹거리X파일, 사르르녹는, 클럽샌드위치, 플레인카스테라, 간식, 동아리방, 생크림카스테라, 카페, 고소한, 빨리먹을수있는, 레알인정"
"709492","금천구","디저트·커피, 마카롱, 케이크"
"710803","용산구","양식, 타코, 부리또"
"713391","성남시 분당구","양식, 안주가맛있는, 튀김덕후, 튀김, 치킨"
"715814","강남구","양식, 채식주의자, 고기성애자, 점심, 깔끔, 저녁, 하이엔드, 스테이크, 가족식탁용, 아이와어른함께, 드레싱이맛있는, 향이좋은, 가성비갑, 육즙이흐르는, 비쥬얼, 치킨리조또, 크림파스타, 파스타, 짭짤한, 오일파스타, 푸짐한, 파인다이닝, 런치세트, 맛집사냥꾼, 밀가루덕후"
"723381","종로구","한식, 해장국, 순대국"
"725052","영등포구","디저트·커피, 단짠단짠, 친구들이랑, 새우토스트mvp, 점심, 소스가맛있는, 베이컨치즈베이글, 패스트푸드, 빵덕후, 햄스페셜토스트, 가성비갑, 캠퍼스안, 입에서순삭, 햄치즈토스트, 불갈비토스트mvp, 착한가격, 딸기주스, 아메리카노, 토핑이다양한, 토스트, 가벼운식사, 빨리먹을수있는, 밀가루덕후"
"739344","동작구","고기, 한식, 연중무휴, 비오는날, 밥집, 친구들이랑, 곰탕, 속이풀리는, 점심, 깔끔, 뼈해장국, 육개장, 한우곰탕, 맑은국물, 속이든든한, 왕갈비전골, 한우수육, 국물덕후, 따끈한, 혼밥, 사골순대국, 집밥, 사골설렁탕, 밥말아먹기좋은, 고향의맛"
"740602","영등포구","일식·회, 연어덮밥, 와규타다끼덮밥"
"747352","용산구","한식, 밥집, 친구들이랑, 매콤, 직원이자신있어하는, 저녁, 향이좋은, 진한국물, 따끈한, 밥볶아먹기좋은, 감자탕, 입맛없을때, 칼칼한, 맛있게매운, 집밥, 맛점, 졸맛, 연인끼리"
"752140","송파구","일식·회, NEW, 단짠단짠, 연인끼리, 기분내기, 친구들이랑, 매콤, 족발세트, 저녁, 촉촉, 가성비갑, 활어초밥, 안주로딱좋은, 새콤, 연어초밥, 초밥, 갓스시, 생대구탕, 적당한, 맛있으면0칼로리, 모듬회, 소고기초밥, 일식전문, 상큼, 담백"
"756280","부천시","분식, 고기, NEW, 모듬꼬치, 닭꼬치"
"757424","금천구","한식, NEW, 부대찌개"
"768728","수원시 영통구","한식, NEW, 전복죽, 볶음밥"
"775515","부평구","디저트·커피, NEW, 샐러드, 샌드위치"
"779599","마포구","고기, NEW, 비오는날, 고기성애자, 소모듬구이, 고깃집, 선선할때, 곱창, 치즈불곱창볶음, 주당, 부드러운, 향이좋은, 육즙이흐르는, 안주로딱좋은, 모듬곱창, 소곱창전골, TV맛집, 순대곱창볶음, 기름진, 야식, 불맛, 탱글탱글, 대창, , 포차"
"782257","종로구","null"
"786815","송파구","디저트·커피, NEW, 쥬스, 아메리카노"
"792959","관악구","디저트·커피, NEW, 와플"
"797652","동대문구","null"
"800995","송파구","null"
"605911","관악구","디저트,커피, 디저트·커피, 주말, 유럽식, 달콤, 여름, 친구들이랑, 누텔라바나나크레페, 해쨍쨍, 비쥬얼, 젤라또그란데, 입에서순삭, 여자들끼리, 브리오슈프렌치토스트, 젤라또프라페, 브런치, 착한가격, 사르르녹는, 혼디, 이색맛집, 카페, 맛점, 레알인정, 연인끼리, 상큼, 꿀맛, 점심, 시원한, 디저트홀릭, 인스타맛집, 폭염, 가성비갑, 그린티프레소, 부담없는, 스무디, 힐링푸드, 초코덕후, 맛있으면0칼로리, 친환경, 취향저격"
