"shop_no","rgn2_nm","content"
"609506","강남구","아시안, 한끼식사되는, 회식, 부드러운, 창스치킨레터스랩, 로메인, 나들이, 동창모임, 크리스피허니쉬림프, 면덕후, 미국식, 창스스파이스치킨, 연인끼리, 창스프라이드라이스, 꿀맛, 바삭바삭, 밥집, 헤비한메뉴, 선선할때, 점심, 사시사철, 몽골리안비프, 가족식탁용, 치킨레터스랩, 고퀄리티, 정갈한, 풍미가깊은, 손님접대, 볶음밥, 스타쉐프"
"632614","강남구","디저트·커피, 패밀리, 달콤, 음료판매, 친구들이랑, 패스트푸드, 프랜차이즈, 비쥬얼, 하프갤론, 여자들끼리, 워크샵, 아이스크림, 브런치, 사르르녹는, 간식, 혼디, 졸맛, 사무실, 시원한, 디저트홀릭, 폭염, 쿼터, 캠퍼스안, 새콤, 힐링푸드, 가볍게먹기좋은, 버라이어티팩, 아이스크림케이크, 파인트"
"672402","송파구","한식, 주말, 계란말이, 밥집, 매콤, 쌀덕후, 점심, 저녁, 유정란왕계란알말이, 세트메뉴가있는, 진한국물, 가성비갑, 속이든든한, 부담없는, 여자들끼리, 얼큰, 남자들끼리, 따끈한, 사리넣으면맛있는, 단골폭발, 착한가격, 혼밥, 김치찌개, 집밥, 숙취해소"
"674274","강남구","고기, 한식, 한끼식사되는, 음료판매, 회식, 외국인친구랑, 저녁, 차돌이불떡볶이, 부드러운, 항정살된장쉑쉑, 나들이, 얼리먹답터, 떡볶이, 안주로딱좋은, 동창모임, 얼큰, 안주가맛있는, 한마리뽕닭, 사무실, 항정살탄탄나베, 저녁에붐비는, 입소문난, 선선할때, 사시사철, 얼큰차돌스튜, 대박, 홍합찜, 야식, 고소한, 포차"
"681343","강남구","양식, 회사동료랑, 꿀맛, 음료판매, 매콤, 직원이자신있어하는, 외국인친구랑, 점심, 해쨍쨍, 타코, 내방, 나들이, 또먹고싶다, 여자들끼리, TV맛집, 퀘사디아, 멕시코전문점, 이색맛집, 런치세트, 가벼운식사, 현지인운영, 졸맛, 사무실"
"689159","광진구","일식·회, 주말, 엄지척, 친구들이랑, 저녁, 부드러운, 사시미모듬, 특초밥, 비쥬얼, 속이든든한, 초밥, 댄스페셜초밥, 사시미, 푸짐한, 일식전문, 맛점, 레알인정, 연인끼리, 썸남썸녀랑, 바삭바삭, 밥집, 입소문난, 점심, 깔끔, 세트메뉴가있는, 부담없는, 베스트초밥B, 반반사시미, 정갈한, 꿀조합, 갓스시, 대박, 튀김덕후, 맛있으면0칼로리, 런치세트, 숨겨진맛집, 담백"
"693669","성북구","분식, 한식, 치즈가워터파크, 한끼식사되는, 쌀덕후, 저녁, 쫄면, 집에서데이트, 내방, 속이든든한, 일본느낌, 입에서순삭, 여자들끼리, 남자들끼리, 폭식하는날, 면덕후, 착한가격, 사르르녹는, 참치주먹밥, 혼밥, 동아리방, 푸짐한, 졸맛, 사무실, 연인끼리, 레알인정, 고추장불고기김밥, 주먹밥, 꿀맛, 건강도시락, 밥집, 김치볶음밥, 바삭바삭, 입소문난, 고기성애자, 점심, 김밥, 가족식탁용, 아이와어른함께, 가성비갑, 캠퍼스안, 부담없는, 충무김밥, 단골폭발, 치즈가흐르는, 숨겨진맛집, 담백"
"694484","강남구","디저트·커피, 한강공원, 달콤, 음료판매, 시원한, 디저트홀릭, 부드러운, 파인트클럽(2개), 내방, 나들이, 폭염, 한입에딱(싱글아이스크림5개), 부담없는, 파인트(1개), 입에서순삭, 여자들끼리, 사르르녹는, 간식, 혼디, 맛있으면0칼로리, 아메리카노, 이색맛집, 모히또, 카페, 한입에딱(싱글아이스크림10개), , 맛점, 연인끼리"
"702170","종로구","분식, 한식, 진미김밥, 꿀맛, 선선할때, 철판제육덮밥, 짱맛, 프랜차이즈, 김밥, 나들이, 내방, 가정식, 캠퍼스안, 부담없는, 가을, 분식, 가볍게먹기좋은, 재료가신선한, 저칼로리, 덮밥, 매운제육쌈김밥, 간식, 건강해지는느낌, 김선생비빔면, 크림치즈김밥, 사무실, 맛점"
"706179","강서구","분식, 순대, 떡볶이"
"717022","동작구","양식, 피자, 파스타"
"722930","서초구","분식, 어묵, 떡볶이"
"723078","고양시 일산서구","양식, 화덕피자, 파스타"
"724114","중구","양식, 파스타, 스테이크"
"730975","관악구","한식, 아삭아삭, 한끼식사되는, 계란말이, 밥집, 친구들이랑, 김치찜, 점심, 캠퍼스안, 부담없는, 국물덕후, 직화콩나물제육, 따끈한, 점심에붐비는, 칼칼한, 맛있게매운, 푸짐한, 탱글탱글, 김치찌개, 집밥, 고등어김치찜"
"736201","강서구","한식, 도가니탕, 수육전골, 비오는날, 밥집, 친구들이랑, 속이풀리는, 점심, 깔끔, 육개장, 맑은국물, 속이든든한, 꼬리곰탕, 국물덕후, 따끈한, 혼밥, 설렁탕, 집밥, 밥말아먹기좋은, 고향의맛"
"745036","고양시 일산동구","분식, 아시안, 치즈까스, 카레밥"
"753224","강서구","한식, NEW, 회사동료랑, 골뱅이무침, 비오는날, 친구들이랑, 주당, 한잔하고싶을때, 우울할때, 시골집느낌, 안주로딱좋은, 먹태, 남자들끼리, 백골뱅이탕, 퇴근후, 짭짤한, 야식, 탱글탱글, 숨겨진맛집, 포차"
"757818","서초구","한식, NEW, 밥집, 해산물덕후, 직원이자신있어하는, 점심, 저녁, 향이좋은, 진한국물, 시골집느낌, 메기양념구이, 원조, 매운탕, 국물덕후, 단골폭발, 칼칼한, 맛있게매운, 집밥, 밥말아먹기좋은"
"760217","강남구","한식, 들깨오리탕, 밥집, 매콤, 고기성애자, 닭한마리, 진한국물, 육즙이흐르는, 부담없는, 곱창전골, 얼큰, 매운음식덕후, 한상차림, 따끈한, 밥볶아먹기좋은, 사리넣으면맛있는, 맛있게매운, 푸짐한, 닭볶음탕, 고향의맛"
"761203","송파구","한식, NEW, 보쌈, 코다리"
"763055","중구","일식·회, 아시안, NEW, 명란아보카도동, 차슈동, 점심, 깔끔, 이국적, 오자츠케, 향이좋은, 진한국물, 일본느낌, 사케동, 국물덕후, 따끈한, 면덕후, 짭짤한, 혼밥, 맛있게매운, 라멘, 일식전문, 고소한, 탱글탱글"
"767749","중랑구","고기, 한식, NEW, 뚝배기, 닭발"
"772118","영등포구","디저트·커피, NEW, 달콤, 음료판매, 친구들이랑, 점심, 시원한, 저녁, 디저트홀릭, 향이좋은, 새콤, 디저트, 따끈한, 점심에붐비는, 24시간영업, 커피, 탱글탱글, 카페, 연인끼리"
"773245","용산구","일식·회, NEW, 닭날개튀김, 회사동료랑, 차돌숙주, 저녁, 이자카야, 부드러운, 스트레스풀자, 주당, 한잔하고싶을때, 김치돈가츠나베, 해물야끼소바, 향이좋은, 안주로딱좋은, 일본느낌, 소스가맛잇는, 퇴근후, 짭짤한, 야식, 모듬가츠, 불맛"
"780847","성남시 분당구","디저트·커피, NEW, 와플, 빙수"
"790175","수원시 영통구","한식, NEW, 쪽갈비, 부대찌개"
"790766","강북구","디저트·커피, NEW, 마카롱, 아메리카노"
"798232","강북구","null"
"802598","관악구","null"
"620520","송파구","고기, 한식, 제육볶음, 주말, 한끼식사되는, 계란말이, 매콤, 저녁, 골뱅이소면, 여자들끼리, 얼큰, 매운불닭, 남자들끼리, 면덕후, 착한가격, 오돌오돌뼈, 혼밥, 점저, 낙지소면, 빨리먹을수있는, 밀가루덕후, 불닭, 깔끔, 부담없는, 중식당, 따끈한, 간편하게먹기, 단골폭발, 불맛, 숙취해소"
"622849","강남구","분식, 한식, 두부김치, 매콤, 음료판매, 회식, 저녁, 떡볶이, 안주로딱좋은, 특이한메뉴, 남자들끼리, 안주가맛있는, 사무실, 심야식당, 저녁에붐비는, 선선할때, 사시사철, 낙지떡볶이, 똥집, 북어탕, 매운똥집, 가볍게먹기좋은, 세젤맛, 치즈계란말이, 따끈한, 쫄깃쫄깃, 퇴근후, 야식, 가이바시떡볶이, 연중무휴, 포차"
"642586","강남구","한식, 주말, 기분내기, 막창, 친구들이랑, 막창구이, 소스가맛있는, 곱창, 퓨전한식, 백순대볶음, 철판요리, 스트레스풀자, 주당, 한잔하고싶을때, 국물파스타, 생일파티, 떡볶이, 안주로딱좋은, 오돌뼈, 풍미가깊은, 쫀득, 짭짤한, 적당한, 야식, 야채곱창볶음"
"661413","강남구","아시안, 칠리새우, 밥집, 잡탕밥, 점심, 베이컨볶음밥, 짱맛, 집에서데이트, 내방, 가족식탁용, 진한국물, 부담없는, 짬뽕, 힐링푸드, 찬바람쌩쌩, 따끈한, 깐풍기, 간편하게먹기, 면덕후, 착한가격, 기름진, 탕수육, 혼밥, 간식, 동아리방, 맛점, 사무실"
"666783","송파구","일식·회, 한끼식사되는, 회식, 저녁, 맑은국물, 속이든든한, 동창모임, 여자들끼리, 남자들끼리, 통우럭찜, 기념일, 사르르녹는, 송파주민인정, 광어회, 푸짐한, 메로구이, 졸맛, 레알인정, 연어회, 저녁에붐비는, 입소문난, 헤비한메뉴, 점심, 깔끔, 가족식탁용, 가성비갑, 고퀄리티, 고급스러운, 갓스시, 단골폭발, 쫄깃쫄깃, 특가일초밥, 건강해지는느낌, 모듬회, 숨겨진맛집, 담백"
"673871","부천시","일식·회, 모밀소바, 한끼식사되는, 친구들이랑, 중화사천라멘, 세르몬롤, 저녁, 프랜차이즈, 진한국물, 비쥬얼, 속이든든한, 입에서순삭, 얼큰, 찬바람쌩쌩, 면덕후, 착한가격, 일식전문, 맛점, 쌀쌀할때, 탄성자동발사, 규동, 점심, 짱맛, 해물야끼우동, 가성비갑, 모듬스시, 부담없는, 따끈한, 퇴근후, 담백"
"688420","성동구","고기, 한식, 몸국, 쌀쌀할때, 보쌈, 겨울, 간이약한, 밥집, 꿀맛, 저녁따끈한, 입소문난, 친구들이랑, 점심, 또똣돼지국밥, 진한국물, 특이한메뉴, 힐링푸드, 풍미가깊은, 간편하게먹기, 착한가격, 혼밥, 고기국수, 비빔고기국수, 푸짐한, 고소한, 보양식, 담백"
"694212","강북구","분식, 한식, 한끼식사되는, 친구들이랑, 돈까스, 퓨전한식, 프랜차이즈, 불고기짜글이, 입에서순삭, 치킨마요, 튀김범벅국물떡볶이, 면덕후, 혼밥, 우동, 점저, 빨리먹을수있는, 매운치즈삼겹살덮밥, 꿀맛, 팬치즈김치볶음밥, 점심, 깔끔, 사시사철, 촉촉, 짱맛, 고구마치즈돈까스, 가성비갑, 캠퍼스안, 정갈한, 따끈한, 과방"
"707410","마포구","아시안, 아삭아삭, 뿌팟봉커리, 한강공원, 한끼식사되는, 저녁, 스윗앤샤워소스치킨, 프랜차이즈, 특이한메뉴, 칠리농어, 왕새우팟타이, 자극적인, 팟타이, 면덕후, 졸맛, 사무실, 밥집, 탄성자동발사, 사시사철, 점심, 이국적, 나시고랭, 가족식탁용, 재료가신선한, 따끈한, 점심에붐비는, 짭짤한, 런치세트, 갈릭쉬림프, 분위기낼때"
"708719","중구","일식·회, 한끼식사되는, 돈까스, 저녁, 히레카츠정식, 프랜차이즈, 내방, 일본느낌, 혼밥, 사보텐정식, 일식전문, 졸맛, 씨푸드카츠정식, 사무실, 회사동료랑, 모짜렐라치즈카츠정식, 바삭바삭, 고기성애자, 사시사철, 점심, 촉촉, 가정식, 정갈한, 따끈한, 맛있으면0칼로리, 히레카츠, 고소한, 런치세트, 담백"
"713069","성남시 분당구","아시안, 쌀국수, 볶음밥"
"729003","중랑구","고기, 주먹밥, 쪽갈비"
"734852","성북구","양식, 카레, 돈까스"
"735311","계양구","분식, 회사동료랑, 분식덕후, 바삭바삭, 친구들이랑, 매콤, 저녁, 매콤새우강정, 주당, 스트레스풀자, 한잔하고싶을때, 편맥과함께, 떡볶이, 떡볶이세트, 새우튀김, 눈꽃치즈새우튀김, 안주로딱좋은, 분식, 수제오징어튀김, 라볶이세트, 쫀득, 퇴근후, 수제왕새우튀김, 기름진, 맛있으면0칼로리, 고소한"
"736749","광진구","한식, 함박스테이크, 부대찌개"
"738308","관악구","고기, 한접시보쌈, 닭곰탕, 저녁에붐비는, 닭갈비, 밥집, 친구들이랑, 매콤, 저녁, 가족식탁용, 아이와어른함께, 닭갈비덮밥, 입에서순삭, 힐링푸드, 따끈한, 쫄깃쫄깃, 맛있게매운, 푸짐한, 불맛, 집밥"
"750517","고양시 일산서구","디저트·커피, 햄치즈토스트, 딸기주스"
"752610","강남구","일식·회, NEW, 아보카도망고커리, 한끼식사되는, 덮밥덕후, 친구들이랑, 매콤, 고로케커리, 소스가맛있는, 카레전문, 닭고기커리, 커리, 향이좋은, 새우야끼커리, 진한국물, 밥한공기뚝딱, 일본느낌, 힐링푸드, 따끈한, 닭고기야끼커리, 맛있게매운, 일식전문, 문어커리, 연인끼리"
"753764","마포구","디저트·커피, NEW, 담백, 주말, 달콤, 두유, 음료판매, 입소문난, 인스타맛집, 베이커리, 부드러운, 통팥두유, 딸기두유, 여자들끼리, 홈메이드, 스콘, 말차두유, 브런치, 크림치즈스콘, 간식, 고소한, 카페, 연인끼리"
"755777","양천구","한식, NEW, 대구탕, 아구찜"
"756454","중랑구","한식, NEW, 감자탕, 뼈해장국"
"757144","종로구","null"
"763252","양천구","한식, NEW, 막창, 곱창"
"766485","광진구","고기, 꿔바로우, 양꼬치"
"774002","부천시","분식, 고기, NEW, 진빵, 만두"
"783825","양천구","분식, NEW, 만두, 만두국"
"785799","용산구","null"
"786571","부천시","디저트·커피, NEW, 아메리카노, 티라미스"
"797437","중구","null"
"798451","중구","null"
"799583","마포구","null"
"802511","수원시 팔달구","null"
"459193","관악구","일식·회, 동양요리, 분식집, 한끼식사되는, 친구들이랑, 저녁, 프랜차이즈, 내방, 맑은국물, 일본느낌, 가을, 규카레동, 카레돈가스, 자취생, 혼밥, 아점, 동아리방, 레알인정, 쌀쌀할때, 겨울, 덮밥덕후, 밥집, 규동, 치킨마요동, 점심, 깔끔, 세트메뉴가있는, 가정식, 캠퍼스안, 부담없는, 정갈한, 간편하게먹기, 과방, 장어덮밥, 차슈데리야끼동, 담백"
"574777","송파구","아시안, 주말, 한강공원, 친구들이랑, 외국인친구랑, 미고랭, 몽골리안, 특이한메뉴, 팟씨유, 저칼로리, 면덕후, 팟타이, 이색맛집, 가벼운식사, 점저, 빨리먹을수있는, 졸맛, 꿀맛, 밥집, 선선할때, 사시사철, 점심, 깔끔, 이국적, 나시고랭, 가성비갑, 캠퍼스안, 부담없는, 카오팟, 재료가신선한, 가볍게먹기좋은, 간편하게먹기, 쫀득, 야구장, 친환경, 담백"
"653588","송파구","한식, 주말, 랍스터, 해물두부김치, 저녁, 얼리먹답터, 속이든든한, 입에서순삭, 여자들끼리, 얼큰, 남자들끼리, 해물닭볶음탕, 안주가맛있는, 폭식하는날, 랍스타조개찜, 해물B, 낙지볶음소면, 닭볶음탕, 레알인정, 심야식당, 저녁에붐비는, 깔끔, 풍미가깊은, 재료가신선한, 쫄깃쫄깃, 해물떡볶이, 불맛, 숨겨진맛집, 포차, 담백"
"661089","강서구","한식, 얼큰설렁탕, 회식, 저녁, 부드러운, 프랜차이즈, 내방, 진한국물, 속이든든한, 설렁탕, 집밥, 보양식, 사무실, 도가니탕, 쌀쌀할때, 겨울, 밥집, 탄성자동발사, 국밥성애자, 점심, 짱맛, 수만두, 가족식탁용, 부담없는, 풍미가깊은, 따끈한, 단골폭발, 고소한, 숙취해소"
"686054","광진구","한식, 주말, 브레이크타임있는, 매콤, 쌀덕후, 속이풀리는, 저녁, 프랜차이즈, 진한국물, 비쥬얼, 속이든든한, 얼큰, 달걀말이, 백채찌개, 푸짐한, 집밥, 맛점, 졸맛, 연인끼리, 친구들끼리, 쌀쌀할때, 비오는날, 밥집, 치즈달걀말이, 사시사철, 점심, 가족식탁용, 아이와어른함께, 가성비갑, 부담없는, 매운음식덕후, 사리넣으면맛있는, 맛있으면0칼로리, 숙취해소, 김치찌개, 갓집밥, 밥말아먹기좋은"
"721674","종로구","양식, 피자, 파스타"
"732856","수원시 영통구","디저트·커피, 달콤, 음료판매, 건강빵, 베이커리, 부드러운, 빵덕후, 향이좋은, 가성비갑, 유기농, 리코타치즈샌드위치, 홈메이드, 크림치즈머핀, 크림치즈브라우니, 빵집, 스콘, 착한가격, 카야토스트, 맛있으면0칼로리, 생크림스콘, 에그타르트, 고소한, 카페, 친환경, 밀가루덕후"
"738622","강남구","디저트·커피, 상큼, 아삭아삭, 모히또에이드, 겨울, 여름, 음료판매, 친구들이랑, 시원한, 자몽주스, 디저트홀릭, 브런치세트, 카페라떼, 여자들끼리, 디저트세트, 디톡스주스, 브런치, 입맛없을때, 간식, 샌드위치, 카페, 케이크, 사무실, 연인끼리"
"741714","서초구","고기, 아시안, 오리탕, 오리고기"
"745293","동작구","디저트·커피, 블랙밀크티, 달콤, 깔끔, 쥬스, 시원한, 디저트홀릭, 초콜렛밀크티, 부드러운, 해쨍쨍, 폭염, 향이좋은, 캠퍼스안, 여자들끼리, 가볍게먹기좋은, 브런치, 입맛없을때, 떡성애자, 밀크티, 토핑이다양한, 카페"
"748414","강남구","일식·회, 단짠단짠, 돈까츠, 회사동료랑, 냉모밀, 친구들이랑, 매콤, 사시사철, 알밥세트, 세트메뉴가있는, 분식, 따끈한, 점심에붐비는, 오므라이스, 입맛없을때, 튀김덕후, 돈가츠오므라이스, 토핑이다양한, 모듬가츠, 치즈볶음밥, 히레가츠, 런치세트, 푸짐한, 사무실"
"755331","마포구","양식, NEW, 아삭아삭, 주말, 한강공원, 바삭바삭, 매콤, 버섯부리또, 점심, 낮술, 이국적, 타코, 나들이, 비쥬얼, 오가닉에이드, 멕시코전문점, 간식, 치킨퀘사디아, 부리또, 치킨부리또보울, 이색맛집, 분위기낼때, 연인끼리"
"756508","영등포구","아시안, NEW, 분짜, 쌀국수, 유린기, 바삭바삭, 매콤, 해산물덕후, 속이풀리는, 점심, 월남쌈, 부드러운, 해물볶음밥, 가성비갑, 동남아음식, 부담없는, 국물덕후, 따끈한, 면덕후, 혼밥, 볶음밥, 탱글탱글, 숙취해소"
"757439","서초구","디저트·커피, NEW, 샌드위치, 커피, 쿠키"
"759668","수원시 영통구","일식·회, NEW, 초밥, 사시미"
"775331","서초구","디저트·커피, NEW, 패밀리, 달콤, 여름, 이거저거다맛있음, 시원한, 디저트홀릭, 부드러운, 해쨍쨍, 폭염, 아이와어른함께, 쿼터, 입에서순삭, 하프갤론, 새콤, 버라이어티팩, 아이스크림, 사르르녹는, 간식, 맛있으면0칼로리, 아이스크림케이크, 핸드팩세트, 카페, 파인트, 연인끼리"
"782192","강남구","고기, 한식, NEW, 주말, 입소문난, 낮술, 저녁, 소스가맛있는, 이국적, 주당, 부드러운, 향이좋은, 고퀄리티, 동남아음식, 안주로딱좋은, 특이한메뉴, 새우볶음밥, 사르르녹는, 바오번, 볶음누들, 연인끼리"
"794091","구로구","한식, NEW, 볶음밥, 죽"
"575238","강남구","동양요리, 아시안, 파인애플새우볶음밥, N3사천해산물팟타이, 월남쌈, P1얇게썬홍두깨쌀국수, 짜죠, 스프링롤"
"635289","서초구","디저트·커피, 팥빙수, 비오는날, 여름, 달콤, 친구들이랑, 시원한, 딸기빙수, 팔인절미설빙, 디저트홀릭, 애플망고치즈설빙, 인절미설빙, 아이와어른함께, 비쥬얼, 입에서순삭, 여자들끼리, 초코브라우니설빙, 재료가신선한, 대박, 간편하게먹기, 쫀득, 사르르녹는, 간식, 고소한, 카페, 졸맛, 상큼, 1인메뉴"
"640961","강남구","고기, 사무실, 취향저격, 한끼식사되는, 바삭바삭, 저녁에붐비는, 친구들이랑, 여름, 회식, 헤비한메뉴, 외국인친구랑, 고기성애자, 저녁, 촉촉, 프랜차이즈, 나들이, 폭염, 가성비갑, 순살크리스피, 안주로딱좋은, 안주가맛있는, 크리스피치킨, 야식, 전기구이치킨, 고소한, 치맥, 포차, 연인끼리"
"643340","강남구","일식·회, 양식, 경양식, 입소문난, 사시사철, 점심, 함박스테이크, 혼술, 부드러운, 해쨍쨍, 내방, 얼리먹답터, 웨이팅긴곳, 비쥬얼, 속이든든한, 육즙이흐르는, 일본느낌, 여자들끼리, 홈메이드, 따끈한, 안주가맛있는, 점심에붐비는, 치킨스테이크, 혼밥, 일식전문, 고소한, 사무실"
"644601","강서구","한식, 주말, 한끼식사되는, 쌀덕후, 점심, 모듬해물죽, 한우야채죽, 호박죽, 부드러운, 프랜차이즈, 내방, 가족식탁용, 가성비갑, 시골집느낌, 동창모임, 입에서순삭, 정통한식, 힐링푸드, 낙지김치죽, 따끈한, 대박, 매생이굴죽, 전복죽, 고소한, 보양식, 졸맛, 담백"
"648009","강남구","고기, 한식, 회사동료랑, 밥집, 친구들이랑, 매콤, 고기성애자, 탄성자동발사, 점심, 깔끔, 저녁, 돼지물갈비, 소스가맛있는, 내방, 가성비갑, 육즙이흐르는, 고기백반, 정갈한, 소갈비우거지전골, 따끈한, 푸짐한, 순두부찌개, 런치세트, 집밥, 갓집밥, 사무실, 생목살김치전골"
"650490","송파구","일식·회, 주말, 음료판매, 회식, 저녁, 내방, 속이든든한, 안주로딱좋은, 얼큰, 저칼로리, 착한가격, 사르르녹는, 광어회, 푸짐한, 일식전문, 사무실, 꿀맛, 바삭바삭, 사시사철, 깔끔, 알탕, 낮술, 세트메뉴가있는, 가족식탁용, 가성비갑, 정갈한, 가볍게먹기좋은, 재료가신선한, 갓스시, 대박, 야식, 포차, 담백"
"654341","서초구","디저트·커피, 달콤, 여름, 미니슈, 부드러운, 프랜차이즈, 또먹고싶다, 향이좋은, 비쥬얼, 초코슈, 입에서순삭, 여자들끼리, 쿠키슈, 슈, 간식, 혼디, 초코디핑슈, 카페, 탄성자동발사, 시원한, 디저트홀릭, 촉촉, 코르네, 오리지널슈, 고퀄리티, 가볍게먹기좋은, 대박, 고소한, 취향저격"
"658454","고양시 일산동구","분식, 달콤, 국물떡볶이, 매콤, 회식, 저녁, 내방, 떡볶이, 안주로딱좋은, 동창모임, 입에서순삭, 분식, 안주가맛있는, 쪽깃쪽깃, 푸짐한, 밀가루덕후, 연인끼리, 바삭바삭, 입소문난, 사시사철, 깔끔, 세트메뉴가있는, 튀김, 부담없는, 따끈한, 쫀득, 야식, 떡성애자, 고소한, 담백"
"689683","성동구","분식, 한식, 친구들이랑, 저녁, 비쥬얼, 속이든든한, 육즙이흐르는, 북촌피냉면, 만두, 착한가격, 기름진, 혼밥, 명물찐만두, 졸맛, 튀김만두, 쌀쌀할때, 겨울, 바삭바삭, 밥집, 갈비만두, 입소문난, 점심, 모듬만두, 냉면, 꿀조합, 따끈한, 간편하게먹기, 점심에붐비는, 고소한, 고향의맛"
"690154","강서구","양식, 유럽식, 썸남썸녀랑, 한끼식사되는, 이탈리안레스토랑, 사시사철, 직원이자신있어하는, 점심, 촉촉, 스테이크, 내방, 고퀄리티, 입에서순삭, 여자들끼리, 디아볼라피칸테피자, 풍미가깊은, 재료가신선한, 따끈한, 멜티드고르곤졸라스테이크피자, 브런치, 파스타, 면덕후, 동아리방, 고소한, 숨겨진맛집, 졸맛"
"700709","서대문구","양식, 레알인정, 연인끼리, 부리또보울, 친구들이랑, 외국인친구랑, 이국적, 데리야끼보울, 타코, 베이컨보울, 내방, 봄, 향이좋은, 캠퍼스안, 가을, 힐링푸드, 가볍게먹기좋은, 브런치, 자극적인, 착한가격, 멕시코전문점, 부리또, 이색맛집, 데리야키플레이트, 맛점, 사무실, 부드러운타코"
"717753","강남구","한식, 갈비탕, 갈갈탕"
"725133","강남구","일식·회, 경양식, 안심카츠, 등심카츠, 바삭바삭, 친구들이랑, 돈까스, 입소문난, 깔끔, 이거저거다맛있음, 촉촉, 아이와어른함께, 원조, 일본느낌, 새우카츠, 카레, 튀김덕후, 푸짐한, 고소한, 밀가루덕후, 연인끼리"
"734792","관악구","일식·회, 홍어삼합, 문어숙회"
"737375","고양시 일산동구","고기, 한식, 곱창"
"741852","서초구","한식, 쌀쌀할때, 회사동료랑, 비오는날, 분식덕후, 밥집, 친구들이랑, 외국인친구랑, 깔끔, 부대볶음, 분식, 국물덕후, 따끈한, 입맛없을때, 칼칼한, 푸짐한, 부대찌개, 맛점"
"744338","강북구","디저트·커피, 몽블랑, 썸남썸녀랑, 달콤, 입소문난, 깔끔, 디저트홀릭, 베이커리, 향이좋은, 비쥬얼, 고퀄리티, 입에서순삭, 여자들끼리, 스콘, 앙팡, 브런치, 간식, 타르트, 아메리카노, 고소한, 카페, 상큼, 연인끼리"
"746923","중구","아시안, 양식, 카레, 오므라이스"
"758736","수원시 영통구","일식·회, NEW, 초밥, 사시미"
"760041","강동구","디저트·커피, 아메리카노, 또띠아"
"760540","서초구","분식, NEW, 단짠단짠, 분식덕후, 친구들이랑, 매콤, 돈까스, 저녁, 쫄면, 김밥, 돈까스김밥, 아이와어른함께, 분식, 따끈한, 간편하게먹기, 오므라이스, 쫀득, 칼칼한, 쫄깃쫄깃, 납작탕수육, 푸짐한, 집밥, 돌판비빔밥, 맛점"
"762361","도봉구","디저트·커피, 아이스크림, 아이스크림케이크"
"763010","강남구","null"
"765519","중구","한식, NEW, 홍설면, 설렁탕"
"765798","강남구","분식, 디저트·커피, NEW, 단짠단짠, 분식덕후, 바삭바삭, 친구들이랑, 핫도그, 아이와어른함께, 입에서순삭, 분식, 힐링푸드, 따끈한, 적당한, 입맛없을때, 튀김덕후, 간식, 토핑이다양한, 고소한, 고추핫도그"
"769033","강남구","디저트·커피, NEW, 아이스크림, 아이스크림케이크"
